<data xmlns:xsi="http://www.w3.org/2001/XMLSchema-instance" xsi:noNamespaceSchemaLocation="../schemas/objects.xsd">
    <object id="door_basic">
        <name>door</name>
        <component type="link">
            <link id="door_link" moveAction="move_door" visible="false"/>
        </component>
    </object>
    <object id="door_fake">
        <name>door</name>
    </object>
    <object id="door_locked">
        <name>door</name>
        <action template="lock_key"/>
        <action template="lock_pick"/>
        <component type="link">
            <link id="door_link" moveAction="move_door" visible="false">
                <conditionMovable>!stat.parentObject.locked</conditionMovable>
            </link>
        </component>
        <localVar name="locked">true</localVar>
        <localVar name="lock_keys">null</localVar>
        <localVar name="lock_pick_difficulty">1</localVar>
    </object>
    <object id="chair_plastic">
        <name>plastic chair</name>
        <component type="usable">
            <slot id="seat">
                <startPhrase>@sit</startPhrase>
                <endPhrase>@getUp</endPhrase>
                <startPrompt>Sit</startPrompt>
                <endPrompt>Stand</endPrompt>
            </slot>
        </component>
    </object>
    <object id="counter">
        <name>counter</name>
    </object>
    <object id="gumball_machine">
        <name>gumball machine</name>
        <action template="vending_machine">
            <parameter name="itemID">"gumball"</parameter>
        </action>
        <networkAction template="vending_machine_hack_price"/>
        <localVar name="price_hacked">false</localVar>
    </object>
    <object id="garbage_bin">
        <name>garbage bin</name>
        <component type="inventory">
            <takePrompt>Take</takePrompt>
            <takePhrase>@takeFrom</takePhrase>
            <storePrompt>Store</storePrompt>
            <storePhrase>@storeIn</storePhrase>
            <inventory>
                <table countMin="0" countMax="3">junk_random</table>
            </inventory>
        </component>
    </object>
    <object id="store_shelf_snacks">
        <name>snacks shelf</name>
        <component type="inventory">
            <takePrompt>Take</takePrompt>
            <takePhrase>@takeFrom</takePhrase>
            <storePrompt>Place</storePrompt>
            <storePhrase>@placeOn</storePhrase>
            <inventory>
                <table>store_snacks</table>
            </inventory>
        </component>
    </object>
    <object id="store_shelf_meals">
        <name>meal shelf</name>
        <component type="inventory">
            <takePrompt>Take</takePrompt>
            <takePhrase>@takeFrom</takePhrase>
            <storePrompt>Place</storePrompt>
            <storePhrase>@placeOn</storePhrase>
            <inventory>
                <table>store_snacks</table>
            </inventory>
        </component>
    </object>
    <object id="store_shelf_alcohol">
        <name>alcohol shelf</name>
        <component type="inventory">
            <takePrompt>Take</takePrompt>
            <takePhrase>@takeFrom</takePhrase>
            <storePrompt>Place</storePrompt>
            <storePhrase>@placeOn</storePhrase>
            <inventory>
                <table>store_snacks</table>
            </inventory>
        </component>
    </object>
    <object id="store_shelf_medicine">
        <name>medicine shelf</name>
        <component type="inventory">
            <takePrompt>Take</takePrompt>
            <takePhrase>@takeFrom</takePhrase>
            <storePrompt>Place</storePrompt>
            <storePhrase>@placeOn</storePhrase>
            <inventory>
                <table>store_snacks</table>
            </inventory>
        </component>
    </object>
    <object id="store_cooler_soft_drinks">
        <name>soft drinks cooler</name>
        <component type="inventory">
            <takePrompt>Take</takePrompt>
            <takePhrase>@takeFrom</takePhrase>
            <storePrompt>Store</storePrompt>
            <storePhrase>@storeIn</storePhrase>
            <inventory>
                <table>store_soft_drinks</table>
            </inventory>
        </component>
    </object>
    <object id="store_cooler_alcohol">
        <name>alcohol cooler</name>
        <component type="inventory">
            <takePrompt>Take</takePrompt>
            <takePhrase>@takeFrom</takePhrase>
            <storePrompt>Store</storePrompt>
            <storePhrase>@storeIn</storePhrase>
            <inventory>
                <table>store_soft_drinks</table>
            </inventory>
        </component>
    </object>
    <object id="vending_machine_nitron">
        <name>Nitron Cola vending machine</name>
        <action template="vending_machine">
            <parameter name="itemID">"nitron_cola"</parameter>
        </action>
        <action template="vending_machine">
            <parameter name="itemID">"nitron_diet"</parameter>
        </action>
        <networkAction template="vending_machine_hack_price"/>
        <localVar name="price_hacked">false</localVar>
    </object>
    <object id="motorcycle">
        <name>motorcycle</name>
        <component type="vehicle" restricted="true" vehicleType="motorcycle"/>
        <component type="usable">
            <slot id="seat">
                <startPhrase>@sit</startPhrase>
                <endPhrase>@getUp</endPhrase>
                <startPrompt>Sit</startPrompt>
                <endPrompt>Stand</endPrompt>
                <exposedComponent>vehicle</exposedComponent>
            </slot>
        </component>
    </object>
    <object id="network_port">
        <name>network port</name>
        <component type="usable">
            <slot id="port">
                <startPhrase>@jackIn</startPhrase>
                <endPhrase>@jackOut</endPhrase>
                <startPrompt>Jack In</startPrompt>
                <endPrompt>Jack Out</endPrompt>
                <exposedComponent>network</exposedComponent>
            </slot>
        </component>
        <component type="network" restricted="true"/>
    </object>
</data>